{
  "$schema": "http://json-schema.org/draft-07/schema#",
  "title": "proposal-evaluation",
  "description": "What /actian-ux-proposal --evaluate writes: the framing, the product read, the scope, and the decisions the ticket forces, with no options, no comparison and no picks. Completed into a proposal-data.json by adding keys, never by renaming one.",
  "type": "object",
  "required": [
    "meta",
    "source",
    "context",
    "scope",
    "research",
    "decisions"
  ],
  "properties": {
    "meta": {
      "type": "object",
      "description": "Document-level context printed in the title strip and the provenance comment",
      "required": [
        "title",
        "date",
        "apps",
        "skill",
        "stage"
      ],
      "properties": {
        "title": {
          "description": "What was asked, in the requester's terms and ten words at most: the page H1 and the document title. It names the ask, never the answer or the constraints on it",
          "type": "string",
          "examples": [
            "DIP-I-496: show role and permission for a logged-in user"
          ]
        },
        "ticket": {
          "description": "Ticket or story id the proposal answers",
          "type": "string",
          "examples": [
            "DIP-I-496"
          ]
        },
        "date": {
          "description": "Authoring date, YYYY-MM-DD, printed in the title strip. Never a render-time clock, so a re-render is byte-identical",
          "type": "string",
          "pattern": "^\\d{4}-\\d{2}-\\d{2}$",
          "examples": [
            "2026-09-11"
          ]
        },
        "apps": {
          "type": "array",
          "description": "App slugs the ticket lives in, printed in the title strip",
          "minItems": 1,
          "items": {
            "description": "An app slug the vendored app-context knows",
            "type": "string",
            "examples": [
              "administration",
              "explorer",
              "studio"
            ]
          }
        },
        "prompt": {
          "description": "The request the document answers, kept in the provenance comment only",
          "type": "string",
          "examples": [
            "Propose a design for this ticket: DIP-I-496"
          ]
        },
        "model": {
          "description": "Model that authored the document, provenance comment only",
          "type": "string",
          "examples": [
            "claude-sonnet-5"
          ]
        },
        "skill": {
          "description": "Always actian-ux-proposal (design-proposal before 2026.9.59, still accepted); lets a reader tell this file from a flow-data.json",
          "type": "string",
          "enum": [
            "actian-ux-proposal",
            "design-proposal"
          ],
          "examples": [
            "actian-ux-proposal"
          ]
        },
        "stage": {
          "type": "string",
          "enum": [
            "evaluation",
            "proposal"
          ],
          "description": "Which stage of the pipeline this file is at. Absent means proposal, which is what every file authored before the evaluation stage existed is, so nothing needs touching. Only --evaluate writes \"evaluation\".",
          "examples": [
            "evaluation"
          ]
        }
      }
    },
    "source": {
      "type": "object",
      "description": "The ticket this proposal answers, as it arrived. Filled from pasted text today and by a fetcher later; nothing downstream cares which",
      "properties": {
        "system": {
          "description": "Where the ticket lives",
          "type": "string",
          "enum": [
            "aha",
            "jira",
            "github",
            "pasted"
          ],
          "examples": [
            "aha",
            "jira",
            "pasted"
          ]
        },
        "id": {
          "description": "The ticket id in that system",
          "type": "string",
          "examples": [
            "DIP-I-496"
          ]
        },
        "url": {
          "description": "A link a reader can follow; omitted for a pasted ticket. Never rendered as a link, the document is offline",
          "type": "string",
          "examples": [
            "https://actian.aha.io/features/DIP-I-496"
          ]
        },
        "title": {
          "description": "The ticket's own title, in its words",
          "type": "string",
          "examples": [
            "Show role and permission for a logged-in user"
          ]
        },
        "body": {
          "description": "The ticket text the proposal was written from, kept so a reader can check the proposal against it",
          "type": "string",
          "examples": [
            "As a user I want to see which permission group I belong to."
          ]
        }
      }
    },
    "context": {
      "type": "object",
      "description": "Where the ticket lives and the question it asks, from the app-context and whatever the request attached",
      "required": [
        "question",
        "product",
        "sources"
      ],
      "properties": {
        "question": {
          "description": "The design question in one sentence, as said in Step 1",
          "type": "string",
          "examples": [
            "How does a logged-in user see their assigned role and permission group?"
          ]
        },
        "ask": {
          "description": "What was asked, in one or two plain sentences from the ticket: who needs what, and why, plus any direction the request added. It opens the document under The ask, above the answer. Optional so older files still render; the validator asks for it",
          "type": "string",
          "examples": [
            "A logged-in user cannot see which permission group they belong to, so they cannot find the guidelines that go with it."
          ]
        },
        "product": {
          "type": "array",
          "description": "Facts about how the product handles this today, one line each: the anchor surface, the data model behind it, what an admin and a user see. Three to six is the useful range and six is the ceiling; fewer than three usually means the product read stopped early. Facts, not a paragraph",
          "minItems": 1,
          "maxItems": 6,
          "items": {
            "description": "One fact in one line",
            "type": "string",
            "examples": [
              "A permission group is a Group record in Administration.",
              "A user can belong to more than one group."
            ]
          }
        },
        "users": {
          "type": "array",
          "description": "Who uses this and in what scenario, one line each, each naming its persona file. It fills intent.md's Target Users; left out, that section reads the gap marker and the handover check flags it",
          "minItems": 1,
          "maxItems": 4,
          "items": {
            "description": "One persona and its scenario in one line",
            "type": "string",
            "examples": [
              "Business user (personas/business-user.md): signed in to Explorer, looking for the guidelines that go with their group."
            ]
          }
        },
        "sources": {
          "type": "array",
          "description": "Where the product read came from: app-context facts and attachments, one line each",
          "minItems": 1,
          "items": {
            "description": "One source, prefixed app-context: or attachment:",
            "type": "string",
            "examples": [
              "app-context: explorer chrome",
              "attachment: DIP-I-496.pdf"
            ]
          }
        },
        "gap": {
          "description": "One sentence naming what the substrate has no capture of, when the anchor surface is uncaptured; absent otherwise",
          "type": "string",
          "examples": [
            "The account dropdown has no capture in app-context."
          ]
        }
      }
    },
    "scope": {
      "type": "object",
      "description": "What the proposal is for and what it deliberately leaves out. Non-goals are what stops a reviewer scoping the work sideways; they are as load-bearing as the goals.",
      "required": [
        "goals",
        "nonGoals"
      ],
      "properties": {
        "goals": {
          "type": "array",
          "description": "One to four things the change must achieve, each in one line, drawn from the ticket rather than invented",
          "minItems": 1,
          "maxItems": 4,
          "items": {
            "description": "One goal in one line",
            "type": "string",
            "examples": [
              "A user can read their permission group without leaving the dropdown."
            ]
          }
        },
        "nonGoals": {
          "type": "array",
          "description": "One to four things this change deliberately does not do, each in one line; the reviewer reads these to know what not to ask for",
          "minItems": 1,
          "maxItems": 4,
          "items": {
            "description": "One non-goal in one line",
            "type": "string",
            "examples": [
              "Editing a permission group from the dropdown; assignment stays in Administration."
            ]
          }
        }
      }
    },
    "research": {
      "type": "object",
      "description": "What the research found, in four lanes (competitors, designSystems, ours, yours), bounded to four findings a lane with a source each; always present, and honest when it did not run",
      "required": [
        "ran",
        "findings"
      ],
      "properties": {
        "lanes": {
          "description": "The lanes that were asked for at the Step 3 gate. Absent on a file written before the lanes existed, which is read as one competitor sweep",
          "type": "array",
          "items": {
            "description": "One lane: competitors (the product space), designSystems (the public canon), ours (the Actian substrate), yours (references the reader supplied at the gate)",
            "type": "string",
            "enum": [
              "competitors",
              "designSystems",
              "ours",
              "yours"
            ],
            "examples": [
              "competitors",
              "ours"
            ]
          },
          "examples": [
            [
              "competitors",
              "designSystems",
              "ours"
            ],
            [
              "ours"
            ]
          ]
        },
        "refs": {
          "description": "The references the reader pasted at the gate, one line each: a URL, a product and screen, or a file they attached. Required when the yours lane ran, and every yours finding must cite one",
          "type": "array",
          "items": {
            "description": "One reference, as the reader gave it",
            "type": "string",
            "examples": [
              "https://atlan.com/product/governance",
              "the Okta admin console, groups page"
            ]
          },
          "examples": [
            [
              "https://atlan.com/product/governance"
            ]
          ]
        },
        "ran": {
          "description": "true when the web research ran; false when it was turned off or unavailable",
          "type": "boolean",
          "examples": [
            true,
            false
          ]
        },
        "findings": {
          "type": "array",
          "description": "At most four findings a lane (validator-enforced); empty when ran is false",
          "items": {
            "type": "object",
            "description": "One finding, with the lane it came from and its source",
            "required": [
              "claim",
              "source"
            ],
            "properties": {
              "lane": {
                "description": "Which lane found it. Absent on a file written before the lanes existed, which is read as competitors",
                "type": "string",
                "enum": [
                  "competitors",
                  "designSystems",
                  "ours",
                  "yours"
                ],
                "examples": [
                  "competitors",
                  "ours"
                ]
              },
              "claim": {
                "description": "One sentence in the reader's words",
                "type": "string",
                "examples": [
                  "Role sits under the name as a secondary identity signal, never above it."
                ]
              },
              "source": {
                "description": "The product, article, substrate file or reference the claim comes from, as text (the document loads nothing). A finding in the ours lane must prefix it with a substrate kind (app-context: guideline: pattern: accessibility: foundations: content: tokens:); a finding in the yours lane must repeat one of research.refs exactly",
                "type": "string",
                "examples": [
                  "SaaS Permissions and Roles UX Patterns, SaaSUI Design",
                  "Carbon, Account menu",
                  "guideline: read-only-tag",
                  "the Okta admin console, groups page"
                ]
              }
            }
          }
        },
        "skippedBecause": {
          "description": "Required when ran is false (validator-enforced): why the research did not run",
          "type": "string",
          "examples": [
            "--no-research",
            "the request said skip research",
            "no web search in this session"
          ]
        }
      }
    },
    "openQuestions": {
      "type": "array",
      "description": "At most four things the proposal does not settle and that do NOT change any pick: a rabbit hole is a detail of a chosen option worth flagging so nobody falls in, an open question is something a reader has to decide later. Anything that would change a pick is that decision's blocker instead. Omit the field when there are none; never invent one.",
      "maxItems": 4,
      "items": {
        "type": "object",
        "description": "One rabbit hole or one open question",
        "required": [
          "kind",
          "text"
        ],
        "properties": {
          "kind": {
            "description": "Which of the two this is",
            "type": "string",
            "enum": [
              "rabbit hole",
              "open question"
            ],
            "examples": [
              "rabbit hole"
            ]
          },
          "text": {
            "description": "One or two sentences, in the reader's words",
            "type": "string",
            "examples": [
              "Truncating a long group list needs a hover affordance the dropdown does not have today."
            ]
          }
        }
      }
    },
    "decisions": {
      "type": "array",
      "minItems": 1,
      "maxItems": 4,
      "description": "One entry per question the ticket forces that a reader could answer differently. At most four, and one is the common case.",
      "examples": [
        [
          {
            "id": "where-the-reach-shows",
            "question": "Where does an admin see a share's real reach?"
          }
        ]
      ],
      "items": {
        "type": "object",
        "required": [
          "id",
          "question"
        ],
        "description": "A decision this ticket forces, named but not yet answered.",
        "examples": [
          {
            "id": "where-the-reach-shows",
            "question": "Where does an admin see a share's real reach?"
          }
        ],
        "properties": {
          "id": {
            "description": "Slug unique in the file; the anchor a reader and the flow bridge address the decision by",
            "type": "string",
            "pattern": "^[a-z0-9][a-z0-9-]*$",
            "examples": [
              "how-a-user-sees-their-group"
            ]
          },
          "part": {
            "description": "What this decision builds, in two to four of the product's words, as Step 4 named it. Optional here; the finished document asks for it",
            "type": "string",
            "examples": [
              "Account menu"
            ]
          },
          "question": {
            "description": "The decision as a question in one sentence",
            "type": "string",
            "examples": [
              "How does a user see which group they belong to?"
            ]
          }
        }
      }
    }
  }
}
